Index,Question,Response,Answer,Accuracy
45,"A woman is brought to the emergency department with dyspnea for 2 days. She is on regular hemodialysis at 3 sessions a week but missed her last session due to an unexpected trip. She has a history of congestive heart failure. After urgent hemodialysis, the patient’s dyspnea does not improve as expected. The cardiologist is consulted. After evaluation of the patient, he notes in the patient’s electronic record: “the patient does not have a chronic heart condition and a cardiac cause of dyspnea is unlikely.” The following morning, the nurse finds the cardiologist’s notes about the patient not having congestive heart failure odd. The patient had a clear history of congestive heart failure with an ejection fraction of 35%. After further investigation, the nurse realizes that the cardiologist evaluated the patient’s roommate, an elderly woman with a similar first name. She is also on chronic hemodialysis. To prevent similar future errors, the most appropriate strategy is to use which of the following?","1. **Two-Patient Identifiers**: Implement a strict policy that requires the use of at least two patient identifiers, such as the patient's full name and date of birth, before any clinical evaluation or intervention. This helps ensure the correct patient is being assessed or treated.

2. **Electronic Health Record (EHR) Alerts**: Develop and utilize EHR systems that incorporate real-time alerts and confirmation prompts when accessing patient records. These alerts can help verify patient identity and avoid mix-ups.

3. **Standardized Patient Rooming Protocols**: Establish standardized protocols for rooming patients that include precise labeling of rooms and patient wristbands with clear, readable information to reduce the chance of mistaken identity. This can also involve patient self-identification processes where patients confirm their identity verbally.",Two patient identifiers at every patient encounter by any healthcare provider,accurate
46,"A female is brought to the emergency department by her husband 1 hour after the onset of chest palpitations. Her symptoms began suddenly while she was drinking coffee and have persisted since then. She has not had shortness of breath, chest pain, dizziness, or loss of consciousness. She has experienced these palpitations before, but they typically resolve spontaneously within a few minutes. She has no history of serious illness and takes no medications. Her temperature is 36.8°C (98.2°F), pulse is 155/min, respirations are 18/min, and blood pressure is 130/82 mm Hg. Pulse oximetry on room air shows an oxygen saturation of 97%. Physical examination shows no abnormalities other than tachycardia. An ECG is shown. Repeated, forceful exhalation against a closed glottis while supine fails to relieve her symptoms. Which of the following is the most appropriate next step in management?","1. **Administer Adenosine**: Adenosine is the primary treatment for stable supraventricular tachycardia (SVT) when vagal maneuvers are ineffective. It works by transiently blocking AV node conduction and can quickly terminate the tachycardia.

2. **Attempt Carotid Sinus Massage**: If initial vagal maneuvers such as the Valsalva maneuver fail, carotid sinus massage can be a useful next step. This also stimulates the vagus nerve and can help convert the rhythm.

3. **Administer Beta-Blocker or Calcium Channel Blocker**: If adenosine is contraindicated or not effective, a beta-blocker (e.g., metoprolol) or a non-dihydropyridine calcium channel blocker (e.g., diltiazem or verapamil) can be used to manage the tachycardia by slowing AV node conduction.",Administer adenosine intravenously,accurate
47,A man comes to the physician because of a 6-month history of epigastric pain and a 9-kg (20-lb) weight loss. He feels full and bloated even after eating small portions of food. His hemoglobin concentration is 9.5 g/dL with a mean corpuscular volume of 78 μm3. Test of the stool for occult blood is positive. Esophagogastroduodenoscopy shows a 2-cm raised lesion with central ulceration on the lesser curvature of the stomach. Histologic examination of a gastric biopsy specimen from the lesion is most likely to show which of the following?,"1. **Adenocarcinoma** - Given the 6-month history of epigastric pain, significant weight loss, anemia with low MCV indicating chronic blood loss, and an endoscopic finding of a raised lesion with central ulceration, gastric adenocarcinoma is the most likely diagnosis. This type of cancer commonly presents with these symptoms and findings.

2. **Gastric lymphoma** - While less common than adenocarcinoma, gastric lymphoma can also present with similar epigastric pain, weight loss, anemia, and ulcerative lesions in the stomach. It would be a plausible secondary diagnosis.

3. **Gastrointestinal stromal tumor (GIST)** - GISTs can present with nonspecific symptoms including abdominal pain, gastrointestinal bleeding, and weight loss. Endoscopic findings might show a lesion with central ulceration, making it a possible but less likely diagnosis compared to adenocarcinoma and lymphoma.",Gland-forming cuboidal cells,inaccurate
48,"A woman is brought to a counselor by her father after he found out that she is being physically abused by her husband. The father reports that she refuses to end the relationship with her husband despite the physical abuse. She says that she feels uneasy when her husband is not around. She adds, “I'm worried that if I leave him, my life will only get worse.” She has never been employed since they got married because she is convinced that nobody would hire her. Her husband takes care of most household errands and pays all of the bills. Physical examination shows several bruises on the thighs and back. Which of the following is the most likely diagnosis?","*1. Battered Woman Syndrome (BWS)* - This diagnosis is part of a broader category of post-traumatic stress disorder (PTSD) experienced by victims of chronic intimate partner violence. Symptoms can include emotional dependency on the abuser, low self-esteem, and a fear that leaving will result in worse circumstances.

*2. Dependent Personality Disorder (DPD)* - This disorder is characterized by an excessive need to be taken care of, leading to submissive and clinging behavior and fears of separation. It explains the woman's inability to leave her abusive husband and her belief that she cannot survive without him.

*3. Learned Helplessness* - This psychological condition occurs when a person has been subjected to repeated stressful or abusive situations and eventually becomes unable to take actions to change their circumstances. It leads to feelings of powerlessness and resignation, often seen in victims of long-term abuse.",Dependent personality disorder,accurate
49,"A homeless HIV-positive male presents with numbness in his hands and feet. The patient says that his symptoms started gradually a couple of weeks ago and have slowly worsened. He describes numbness initially in just his fingertips and toes, but it has now spread to involve his entire hands and feet. Past medical history is significant for HIV diagnosed many years ago, for which the patient has never sought treatment. The patient also has a long history of various illnesses, especially chronic diarrhea, but he is unable to remember any details. He currently takes no medications. The patient has been homeless for years, and he denies any alcohol or drug use. Review of systems is significant for a sore tongue. His temperature is 37°C (98.6°F), blood pressure is 100/65 mm Hg, pulse is 102/min, respiratory rate is 25/min, and oxygen saturation is 97% on room air. On physical exam, the patient is alert and oriented, his body habitus is cachectic, and his BMI is 17 kg/m2. His tongue appears erythematous and smooth with loss of papillae, but no lesions or evidence of infection is noted. Cardiac exam is normal apart from tachycardia. Lungs are clear to auscultation. His abdomen is soft and nontender with no hepatosplenomegaly. There is decreased 2-point discrimination in the hands and feet bilaterally. Strength in the hands and feet is 4/5 bilaterally. Reflexes are absent in the ankles. Gait is slightly wide-based and ataxic, and there is a positive Romberg sign. Which of the following is the most likely cause of this patient’s symptoms?","1. **Vitamin B12 Deficiency**: The sore tongue, pallor, and symptoms of peripheral neuropathy—including numbness in the hands and feet, ataxic gait, and positive Romberg sign—strongly suggest vitamin B12 deficiency. The patient's cachectic state, chronic diarrhea, and poor nutrition due to homelessness may have led to this deficiency.

2. **HIV-Associated Neuropathy**: Given the patient's history of untreated HIV, it is possible that the numbness and other neuropathic symptoms are due to HIV-associated neuropathy. This is a common complication in HIV-positive individuals, particularly those with advanced disease and poor treatment adherence.

3. **Alcoholic Neuropathy**: Although the patient denies alcohol use, chronic alcoholism is a common cause of peripheral neuropathy. The described symptoms—numbness progressing from distal to proximal extremities, along with ataxia and reflex changes—can be consistent with this condition if the patient's history of alcohol use were not accurately reported. However, this is less likely given the denial of alcohol use.",Elevated levels of methylmalonic acid (MMA),relevant
