Index,Question,Response,Answer,Accuracy
16,"A woman is referred to a cardiologist for evaluation of syncope. Over the past year she has experienced 2 syncopal events. The first event occurred while she was standing, and the second when she laid down on her side. She denies bowel or bladder incontinence during the episodes or palpitations. However, she reports the presence of a low-grade fever over the past 3 months and a recent visit to the emergency department for a transient ischemic attack. She has a history of intravenous drug use but reports not having used in over 5 years. Temperature is 100.0°F (37.8°C), pressure is 115/72 mmHg, pulse is 90/min, and respirations are 20/min and regular. A detailed neurologic examination reveals no focal deficits. Cardiac auscultation demonstrates a diastolic ""plop"" at the cardiac apex. Which of the following findings will most likely be demonstrated on transthoracic echocardiography?","1. **Left atrial myxoma**: The diastolic ""plop"" sound at the cardiac apex, history of syncope, and presence of a low-grade fever suggest a cardiac myxoma. Left atrial myxomas can obstruct blood flow intermittently, causing syncope, and can also release pro-inflammatory cytokines leading to fever.

2. **Mitral valve prolapse**: While this condition can sometimes lead to syncope, it is less specific given the clinical presentation. Mitral valve prolapse may be noted on echocardiography, but it does not typically explain the fever or the diastolic plop.

3. **Aortic stenosis**: This condition can cause syncope, especially during exertion or positional changes, and might be picked up on echocardiography. However, it is less likely given the description of a diastolic sound and the presence of fever, making left atrial myxoma a more plausible primary diagnosis.",Left atrial pedunculated mass,accurate
17,"A man comes to the physician for a routine health maintenance examination. He feels well. He has hypertension and gastroesophageal reflux disease. Current medications include metoprolol and pantoprazole. He does not smoke or drink alcohol. Temperature is 37.3°C (99.1°F), pulse is 75/min, and blood pressure is 135/87 mm Hg. Examination shows no abnormalities. Laboratory studies show:
Hematocrit 43%
Leukocyte count 32,000/mm3
Segmented neutrophils 22%
Basophils 1%
Eosinophils 2%
Lymphocytes 74%
Monocytes 1%
Platelet count 190,000/mm3
Blood smear shows small, mature lymphocytes and several smudge cells. Immunophenotypic analysis with flow cytometry shows B-cells that express CD19, CD20 and CD23. Which of the following is the most appropriate next step in management?","1. **Observation and regular monitoring** - Given the patient's asymptomatic status and the laboratory findings, the most likely diagnosis is chronic lymphocytic leukemia (CLL). Observation with regular follow-ups is appropriate for early-stage, asymptomatic CLL, as immediate treatment is not necessary until symptoms or disease progression occur.

2. **Bone marrow biopsy** - This can be performed to confirm the diagnosis and to assess the extent of marrow infiltration. While not always immediately necessary if the clinical picture is clear, it can provide valuable prognostic information.

3. **Flow cytometry of peripheral blood** - Though already implied from the immunophenotypic analysis, additional flow cytometry might be warranted to further characterize the abnormal lymphocyte population and confirm the diagnosis of CLL.",Observation and follow-up,accurate
18,"A woman comes to the emergency department because of weakness and fatigue for 2 days. She has also noticed that her urine is darker than usual. For the past week, she has had a persistent non-productive cough and low-grade fever. She has seasonal allergies. She drinks one to two glasses of wine on social occasions and does not smoke. Her temperature is 37.9°C (100.2°F), pulse is 88/min, respirations are 18/min, and blood pressure is 110/76 mm Hg. She has conjunctival pallor and scleral icterus. Cardiopulmonary examination shows bibasilar crackles. The remainder of the physical examination shows no abnormalities. Laboratory studies show:
Leukocyte count 8,000/mm3
Hemoglobin 7.1 g/dL
Hematocrit 21%
Platelet count 110,000/mm3
MCV 94 μm3
Serum
Total bilirubin 4.3 mg/dL
Direct 1.1 mg/dL
Indirect 3.2 mg/dL
AST 15 U/L
ALT 17 U/L
LDH 1,251 U/L
Haptoglobin 5.8 mg/dL (N = 41–165)
An x-ray of the chest shows bilateral patchy infiltrates. A peripheral blood smear shows spherocytes. Which of the following is most likely to confirm the diagnosis?","1. **Direct Coombs test** - This test will detect antibodies or complement proteins attached to the surface of red blood cells, which is indicative of autoimmune hemolytic anemia (AIHA). Given the presence of spherocytes, elevated LDH, low haptoglobin, and indirect hyperbilirubinemia, AIHA is the most likely diagnosis.

2. **Cold agglutinin test** - This test checks for the presence of cold agglutinins, which can cause hemolysis at low temperatures and could also account for similar symptoms, especially if the woman had an infection that caused this response. It's less likely compared to a Direct Coombs test but still relevant.

3. **Parvovirus B19 serology** - Although less likely in this scenario given the presence of hemolytic markers, parvovirus B19 can cause aplastic crises in individuals with preexisting hemolytic anemias, which could be a differential diagnosis.",Direct Coombs test,accurate
19,A woman comes to the physician with concerns about swelling and pain in her right breast. Physical examination shows erythema and prominent pitting of the hair follicles overlying the upper and lower outer quadrants of the right breast. There are no nipple changes or discharge. A core needle biopsy shows invasive carcinoma of the breast. Which of the following is the most likely explanation for this patient's skin findings?,"1. **Lymphatic obstruction:** The physical findings of erythema and pitting of the hair follicles (often referred to as peau d'orange) are most consistent with lymphatic obstruction caused by invasive carcinoma of the breast. Cancer cells can invade and block the lymphatic vessels, leading to swelling and characteristic skin changes.

2. **Inflammatory breast cancer:** Although less common, inflammatory breast cancer can present with similar skin changes, including erythema and peau d'orange. This type of breast cancer is highly aggressive and involves the dermal lymphatics, causing rapid changes in the appearance of the skin.

3. **Cellulitis:** While less likely in the context of a biopsy-confirmed invasive carcinoma, severe cellulitis could theoretically cause erythema and pitting of the hair follicles. However, the presence of invasive carcinoma on biopsy makes this less probable.",Obstruction of the lymphatic channels,accurate
20,"A scientist is studying a protein that is present on the plasma membrane of cells. The protein is purified in a lipid bilayer and subjected to various conditions. The investigations reveal the following properties:

1) It changes ion concentrations across the membrane without requiring ATP.

2) Its activity increases linearly with substrate concentration without saturation even under mildly supraphysiologic conditions.

3) It changes ion concentrations only in certain states, while having no effect in other states.

4) Changing the electrical charge across the membrane does not influence its activity.

5) Adding a small amount of an additional substance consistently increases the protein's activity.

These findings are consistent with a protein with which of the following functions?","1. **Ion Channel:** Ion channels can change ion concentrations across the membrane without requiring ATP and their activity can be modulated by certain substances. However, many ion channels do show saturation and are often influenced by the electrical charge across the membrane. Given that the described properties do not entirely match with classic ion channels, this is the second most plausible answer.

2. **Ionophore:** Ionophores are compounds that facilitate the transport of ions across the membrane without requiring ATP. They can change ion concentrations and their activity may increase with the presence of certain substances. Ionophores also do not typically show saturation at physiological ranges, making this the most plausible answer.

3. **Facilitated Diffusion Transporter:** These transporters can move ions across the membrane without requiring ATP and can be regulated by other substances. While they often show saturation kinetics and can be influenced by membrane electrical charge, some non-traditional facilitated diffusion transporters might fit the described properties under certain experimental conditions. Therefore, this is the third most plausible answer.",Mediating neuronal to muscle end plate communication,inaccurate
21,"A male with congestive heart failure recently had his medication regiment adjusted to better control his hypertension. Three weeks later, laboratory analysis shows his serum calcium and magnesium levels have both decreased. The diuretic used in this patient acts predominantly on which nephron segment:","1. **Thick ascending limb of the loop of Henle:** Loop diuretics, such as furosemide, act on this segment and are known to cause decreases in both serum calcium and magnesium levels by inhibiting the Na-K-2Cl cotransporter, leading to increased excretion of these electrolytes.

2. **Distal convoluted tubule:** Thiazide diuretics act on this segment and typically cause a decrease in serum magnesium, but they generally lead to an increase in serum calcium by promoting calcium reabsorption. While this is less likely given the patient's decreased calcium levels, it is worth considering.

3. **Proximal convoluted tubule:** Less commonly implicated but certain diuretics like carbonic anhydrase inhibitors act here. They are not typically associated with significant changes in calcium and magnesium levels comparable to loop diuretics, making this the least likely option among the top three.",Thick ascending loop of Henle,accurate
22,"A G2P1 female at 37 weeks of gestation presents to the clinic for complaints of right-hand numbness and pain for the past month. She reports that the pain is usually worse at night and that she would sometimes wake up in the middle of the night from the “pins and needles.” She denies fever, weakness, or weight changes but endorses paresthesia and pain. The patient also reports a fall on her right hand 2 weeks ago. A physical examination demonstrates mild sensory deficits at the first 3 digits of the right hand but no tenderness with palpation. Strength is intact throughout. Which of the following findings would further support the diagnosis of this patient’s condition?","1. *Positive Tinel's sign*: Tapping over the carpal tunnel elicits tingling or pain in the distribution of the median nerve (1st to 3rd digits), which is indicative of carpal tunnel syndrome.
2. *Positive Phalen’s test*: Holding the wrists in a flexed position for about 60 seconds reproduces symptoms such as numbness, tingling, or pain in the median nerve distribution, further supporting carpal tunnel syndrome.
3. *Electrodiagnostic studies showing delayed median nerve conduction*: Nerve conduction studies that demonstrate slowed conduction velocity or prolonged distal latency of the median nerve can confirm the diagnosis of carpal tunnel syndrome.",Tingling when the right wrist is percussed,accurate
23,"A man is brought to the emergency department by his daughter. She reports that her father drank heavily for the last 16 years but stopped 4 days ago after deciding to quit drinking on his birthday. She also reports that he has been talking about seeing cats running in his room since this morning, although there were no cats. There is no history of any known medical problems or any other substance use. On physical examination, his temperature is 38.4ºC (101.2ºF), heart rate is 116/min, blood pressure is 160/94 mm Hg, and respiratory rate is 22/min. He is severely agitated and is not oriented to his name, time, or place. On physical examination, profuse perspiration and tremors are present. Which of the following best describes the pathophysiologic mechanism underlying his condition?","1. **Alcohol Withdrawal Delirium (Delirium Tremens)**: The most plausible explanation for this patient's symptoms is alcohol withdrawal delirium, also known as delirium tremens (DTs). DTs usually occur 48 to 72 hours after cessation of heavy alcohol use, but can occur up to 7 days later. The condition is characterized by severe agitation, confusion, hallucinations (such as seeing cats), fever, tachycardia, hypertension, sweating, and tremors. The pathophysiological mechanism involves a hyperadrenergic state due to the sudden removal of the central nervous system depressant (alcohol). This results in an upregulation of excitatory neurotransmitters (e.g., glutamate) and a downregulation of inhibitory neurotransmitters (e.g., GABA).

2. **Alcoholic Hallucinosis**: Another possible explanation is alcoholic hallucinosis, which is a condition characterized by hallucinations (often auditory, but can be visual or tactile) occurring within 12 to 24 hours of the last drink and can last up to 48 hours. However, alcoholic hallucinosis typically does not present with the severe autonomic instability (elevated heart rate, blood pressure, and temperature) or profound disorientation that this patient is experiencing.

3. **Wernicke Encephalopathy**: Wernicke encephalopathy, due to thiamine deficiency commonly seen in chronic alcoholics, could also be a consideration. It typically presents with a triad of confusion, ataxia (lack of muscle coordination), and ophthalmoplegia (eye movement abnormalities). Although some symptoms like confusion and disorientation match, the presence of hallucinations and significant autonomic hyperactivity is less consistent with Wernicke encephalopathy. 

Thus, the best explanation is alcohol withdrawal delirium (delirium tremens).",Increased activity of NMDA receptors,Relevant
24,"A 2-week-old female newborn is brought to the physician for the evaluation of red eyes with discharge for 2 days. She was born at 39 weeks' gestation to a woman. Pregnancy and delivery were uncomplicated. The mother received irregular prenatal care during the second half of the pregnancy. The newborn weighed 3700 g (8 lb 2.5 oz) at birth, and no congenital anomalies were noted. She currently weighs 4000 g (8 lb 13 oz). Examination of the newborn shows pink skin. The lungs are clear to auscultation. There is mucopurulent discharge in both eyes and mild eyelid swelling. Polymerase chain reaction assay of conjunctival scraping confirms the diagnosis. Which of the following is the most appropriate next step in management?","1. **Oral erythromycin therapy** - This is the most appropriate treatment for neonatal Chlamydia trachomatis conjunctivitis, which is likely given the age of onset and the symptoms described.

2. **Topical erythromycin ointment** - Although it is more commonly used for prophylaxis and would be less effective alone compared to oral treatment, it can be considered as an adjunct treatment for Chlamydia trachomatis.

3. **Intravenous ceftriaxone** - This would be considered if Neisseria gonorrhoeae conjunctivitis were suspected. However, the diagnosis here strongly points towards Chlamydia trachomatis, for which oral erythromycin is the treatment of choice.",Oral erythromycin administration,accurate
25,A boy is brought to the physician because of a 1-day history of severe left hand pain. He has had similar painful episodes in the past that required hospitalization. Physical examination shows pale conjunctivae. There is tenderness on palpation of the wrist and the small joints of the left hand. Peripheral blood smear shows crescent-shaped erythrocytes. He is started on a pharmacologic agent that is known to cause macrocytosis. This drug causes an arrest in which of the following cell cycle phases?,"1. **S phase** - The drug causing macrocytosis is likely to be hydroxyurea, which works by inhibiting ribonucleotide reductase, leading to arrest during the DNA synthesis (S) phase of the cell cycle.

2. **G2 phase** - Some drugs can impact the G2 phase by interfering with DNA repair mechanisms, although this is less specific in the context of causing macrocytosis.

3. **M phase** - Though less likely, certain chemotherapeutic agents that induce macrocytosis can arrest cells in the mitosis (M) phase, though this is not typically associated with the drug likely used in this scenario.",S phase,accurate
26,"A man comes to the physician because of an 8-month history of upper abdominal pain. During this period, he has also had nausea, heartburn, and multiple episodes of diarrhea with no blood or mucus. He has smoked one pack of cigarettes daily for the past 18 years. He does not use alcohol or illicit drugs. Current medications include an antacid. The abdomen is soft and there is tenderness to palpation in the epigastric and umbilical areas. Upper endoscopy shows several ulcers in the duodenum and the upper jejunum as well as thick gastric folds. Gastric pH is < 2. Biopsies from the ulcers show no organisms. Which of the following tests is most likely to confirm the diagnosis?","1. *Serum gastrin level*: The man's symptoms, along with the presence of multiple ulcers in the duodenum and upper jejunum and thick gastric folds, are suggestive of Zollinger-Ellison syndrome (ZES), a condition characterized by excessive gastrin production typically due to a gastrin-secreting tumor (gastrinoma). Measuring the serum gastrin level can help confirm this diagnosis as patients with ZES usually have markedly elevated gastrin levels.

2. *Secretin stimulation test*: If the serum gastrin level is borderline or moderately elevated, a secretin stimulation test can be used to further evaluate the possibility of ZES. In this test, secretin is administered and serum gastrin levels are measured. Patients with ZES typically exhibit a pronounced increase in gastrin levels following secretin administration.

3. *Fasting serum chromogranin A (CgA) level*: Chromogranin A is a marker for neuroendocrine tumors, including gastrinomas. Elevated levels of CgA can support the diagnosis of a gastrinoma. However, this test is less specific than serum gastrin measurement and can be influenced by other factors, making it a supplementary test rather than a primary diagnostic tool.",Fasting serum gastrin level,accurate
27,"A newborn boy born vaginally to a healthy G3P1 from a pregnancy complicated by hydramnios fails to pass meconium after 24 hours of life. The vital signs are within normal limits. The abdomen is distended, the anus is patent, and the rectal examination reveals pale mucous with non-pigmented meconium. Based on a barium enema, the boy is diagnosed with sigmoid colonic atresia. Disruption of which structure during fetal development could lead to this anomaly?","1. *Inferior Mesenteric Artery* - The inferior mesenteric artery supplies blood to the distal part of the colon (including the sigmoid colon). Disruption of its blood flow during fetal development can lead to ischemia and subsequent atresia of the affected segment.

2. *Umbilical Arteries* - These arteries are involved in fetal circulation and supply blood to various pelvic organs and structures. Issues with the umbilical arteries could lead to compromised blood flow affecting the development of the lower gastrointestinal tract and colon.

3. *Hindgut* - The hindgut is the embryonic precursor to the distal colon, sigmoid colon, rectum, and part of the anal canal. Abnormal development or disruption in the differentiation or recanalization of the hindgut can result in congenital anomalies such as colonic atresia.",Inferior mesenteric artery,accurate
28,"A woman presents with memory problems for the past few weeks. She vividly describes forgetting where she put her car keys this morning and not remembering to wish her grandson a happy birthday last week. She denies any cognitive problems, bowel/bladder incontinence, tremors, gait problems, or focal neurologic signs. She mentions wanting to take Ginkgo because her friend told her that it can help improve brain function and prevent memory loss. Her past medical history is significant for an acute cardiac event several years ago. Her current medications are aspirin, carvedilol, and captopril. She denies any history of smoking, alcohol, or recreational drug use. She is a widow, lives alone, and is able to perform all activities of daily living (ADLs) easily. There is no significant family history. She is afebrile and her vital signs are within normal limits. Physical examination is unremarkable. Which of the following would be the most appropriate response to her request to take Ginkgo?","1. **Discuss potential risks of bleeding**: Explain to the patient that Ginkgo biloba can increase the risk of bleeding, especially when taken with medications like aspirin. Given her history of an acute cardiac event and her current use of aspirin, it is important to avoid any additional bleeding risks.

2. **Evaluate and address other causes of memory loss**: Suggest that her memory problems could be due to several potential factors, including stress, sleep issues, or mild cognitive impairment. Recommend a thorough evaluation by her primary care physician or a neurologist to rule out any underlying conditions that might be causing her memory concerns.

3. **Consider a comprehensive approach to cognitive health**: Recommend non-pharmacological approaches to improve cognitive function, such as regular physical exercise, mental stimulation activities (e.g., puzzles, reading), social engagement, and a balanced diet rich in fruits, vegetables, and omega-3 fatty acids. Additionally, discuss the importance of managing cardiovascular health to prevent further cognitive decline.","""No, taking ginkgo will increase your risk for bleeding.""",accurate
29,"A man presents to his primary care physician complaining of heartburn and mild epigastric pain after eating for the past 6 months. He reports that his symptoms occur within an hour of eating a meal and persist for approximately an hour. He admits his symptoms have been progressively worsening. He recently began having these symptoms when he lies in the supine position. He has tried eating smaller meals and avoiding spicy food to no avail. He denies vomiting, difficulty swallowing, recent weight loss, or changes in stool color. He does admit to having a ""sour"" taste in his mouth when symptomatic. His temperature is 99.0°F (37.2°C), blood pressure is 149/82 mmHg, pulse is 86/min, respirations are 18/min, and BMI is 32 kg/m^2. His abdomen is soft, non-tender, and bowel sounds are auscultated in all quadrants. Laboratory results demonstrate the following:

Serum:
Hemoglobin: 13.5 g/dL
Hematocrit: 41%
Leukocyte count: 4,500/mm^3 with normal differential
Platelet count: 257,000/mm^3
Fecal occult blood test (FOBT): Negative

Which of the following is the next best step in management?","1. *Initiate a proton pump inhibitor (PPI) trial*: Given the patient's history of heartburn, epigastric pain, and symptoms worsening in the supine position, as well as the ""sour"" taste in his mouth, the most likely diagnosis is gastroesophageal reflux disease (GERD). A PPI trial is a commonly accepted initial step in managing GERD and can help alleviate symptoms by reducing stomach acid production.

2. *Lifestyle modifications and dietary adjustments*: Although the patient has already tried eating smaller meals and avoiding spicy foods, additional recommendations such as avoiding eating late at night, elevating the head of the bed, and losing weight (given his BMI of 32 kg/m^2) could further help manage his symptoms. 

3. *Upper gastrointestinal endoscopy (EGD)*: If symptoms persist despite appropriate medical therapy with PPIs, or if there are alarm features like weight loss, dysphagia, or signs of gastrointestinal bleeding, an upper GI endoscopy would be indicated to evaluate for complications such as esophagitis, Barrett's esophagus, or peptic ulcer disease. Although this is not the immediate next step, it is crucial for further investigation if initial treatments are unsuccessful.",Omeprazole,Accurate
