Index,Question,Response,Answer,Accuracy
13,"An individual with a history of acute lymphoblastic leukemia is brought to the clinic because of pruritic vesicles that appeared on the left side of their torso 12 hours ago. One day earlier, before the appearance of the vesicles, the individual had been complaining of a burning sensation in that area. They have been receiving chemotherapy consisting of methotrexate, cytarabine, and cyclophosphamide for 1 month. The last treatment was received 2 days ago. There is no other past medical history. The individual is afebrile and vital signs are within normal limits. Upon physical examination, there are painful vesicles localized to the left C7 skin dermatome. Which of the following is the most likely etiology of the skin lesions in this patient?","1. **Herpes Zoster (Shingles)**: The presentation of pruritic and painful vesicles localized to a specific dermatome, particularly following the description of a burning sensation prior to vesicle appearance, strongly suggests Herpes Zoster. The history of chemotherapy, which can weaken the immune system, further supports this diagnosis as reactivation of the Varicella-Zoster virus is common in immunocompromised individuals.

2. **Chemotherapy-induced Dermatitis**: Although less likely given the dermatomal distribution, it is possible that the skin lesions are due to a reaction to the chemotherapeutic agents. Chemotherapy can lead to various skin reactions, but they typically do not present in a strictly dermatomal distribution and usually are not vesicular.

3. **Localized Bacterial Skin Infection (Cellulitis)**: While cellulitis could cause localized pain and erythema, it is typically less likely to present as pruritic vesicles. Additionally, bacterial infections would usually be expected to cause more systemic symptoms such as fever, which this patient does not have.",Reactivation of VZV due to immunodeficiency caused by chemotherapy,accurate
14,"An individual presents with a lump on the neck. They state the mass gradually onset 2 months ago and has been progressively enlarging. They deny any pain, weight loss, fevers, chills, or night sweats. Past medical history is significant for HIV, diagnosed 5 years ago, managed on a new HAART regimen that was just started. The individual is afebrile and vital signs are within normal limits. Physical examination shows a 3 cm mobile firm mass on the left lateral side of the neck immediately below the level of the thyroid cartilage. A biopsy of the mass is performed and reveals atypical mononuclear cells in a background of eosinophils, plasma cells, histiocytes, atypical T-lymphocytes, and bilobed cells (shown in image). Which of the following is the most likely diagnosis?","1. **Hodgkin Lymphoma**: The presence of a progressively enlarging, painless lymph node along with the biopsy findings of atypical mononuclear cells and bilobed cells (Reed-Sternberg cells) in a background of eosinophils, plasma cells, histiocytes, and atypical T-lymphocytes is highly suggestive of Hodgkin lymphoma. This condition can occur at a higher rate in individuals with HIV.

2. **Non-Hodgkin Lymphoma**: Given the individual's HIV status, they are at an increased risk for non-Hodgkin lymphoma, which often presents with similar symptoms of painless lymphadenopathy. The biopsy findings, although more characteristic of Hodgkin lymphoma, could still potentially occur in non-Hodgkin lymphoma subtypes.

3. **Reactive Lymphadenopathy**: This is a less likely but possible cause, as HIV-infected individuals can develop reactive lymphadenopathy due to various infections or immune activation. However, the presence of atypical cells in the biopsy makes this diagnosis less likely compared to Hodgkin lymphoma.",Mixed cellularity classical Hodgkin lymphoma,Relevant
15,"An individual with a history of gluten intolerance presents to the emergency department with persistent vomiting and diarrhea, but no fever, after recently returning from a vacation in Central America. The diarrhea is described as profuse and almost clear. On physical examination, skin turgor is decreased and blood pressure is 90/60 mm Hg. The individual is administered a saline solution and admitted for further examination and observation. What shifts are expected to be seen in this patient's Darrow-Yannet diagram before the administration of saline?","1. **Decreased Extracellular Fluid (ECF) Volume and Decreased Intracellular Fluid (ICF) Volume:** The patient is experiencing significant fluid loss through vomiting and diarrhea, leading to a reduction in both ECF and ICF. On the Darrow-Yannet diagram, this would be represented by a leftward shift or reduction in the ECF compartment and a downward shift or reduction in the ICF compartment, reflecting dehydration.

2. **Increased ECF Osmolarity:** Due to the loss of hypotonic fluids (which are relatively low in salt compared to blood plasma), there will be an increase in the osmolarity of the remaining ECF. On the Darrow-Yannet diagram, this may be indicated by an upward shift of the ECF compartment reflecting higher osmolarity.

3. **Decreased Blood Pressure and Hypovolemic Shock Indicators:** The patient's hypotension (blood pressure of 90/60 mm Hg) is indicative of reduced circulating blood volume. The diagram would therefore show a significant contraction in the ECF volume. This overall hypovolemia can further exacerbate the reduction in both ECF and ICF volumes as the body tries to manage the reduced fluid availability.

These changes collectively reflect severe dehydration and volume depletion status as depicted on the Darrow-Yannet diagram.",Decreased extracellular volume with no change in osmolarity,Inaccurate
16,"Two days after undergoing left hemicolectomy for a colonic mass, a patient develops shortness of breath. Their temperature is 38.1°C (100.6°F), pulse is 80/min, respirations are 22/min, and blood pressure is 120/78 mm Hg. Pulse oximetry on room air shows an oxygen saturation of 88%. Cardiopulmonary examination shows decreased breath sounds and decreased fremitus at both lung bases. Arterial blood gas analysis on room air shows:
pH 7.35
PaO2 70 mm Hg
PCO2 40 mm Hg
An x-ray of the chest shows a collapse of the bases of both lungs. Which of the following is the most likely underlying mechanism of this patient's hypoxemia?","1. **Atelectasis**: This condition involves the partial collapse of the lung or lobe and is common postoperatively, especially after abdominal surgery like a hemicolectomy. The physical findings of decreased breath sounds and decreased fremitus at both lung bases, combined with the chest X-ray showing collapse at lung bases, point to atelectasis. Hypoxemia results from the impaired gas exchange due to the collapsed lung tissue.

2. **Pulmonary Embolism**: Although the clinical findings are more suggestive of atelectasis, a pulmonary embolism (PE) should also be considered in postoperative patients who present with sudden shortness of breath. This can lead to hypoxemia due to impaired pulmonary circulation. The patient's relatively stable vital signs and absence of hemodynamic compromise, however, make PE less likely compared to atelectasis.

3. **Pneumonia**: Postoperative pneumonia is a possible cause of hypoxemia and respiratory distress, especially in patients with recent abdominal surgery and immobilization. The elevated temperature could suggest an infectious process. However, the absence of localized lung consolidation or infiltrates on chest X-ray makes pneumonia less likely than atelectasis.

These answers are based on the clinical data provided and common postoperative complications.",Decreased ratio of ventilated alveoli,inaccurate
17,"An individual is brought to the emergency department after being involved in a rear-end collision, in which they were the restrained driver of the back car. On arrival, they are alert and active. They report pain in both knees and severe pain over the right groin. Temperature is 37°C (98.6°F), pulse is 116/min, respirations are 19/min, and blood pressure is 132/79 mm Hg. Physical examination shows tenderness over both knee caps. The right groin is tender to palpation. The right leg is slightly shortened, flexed, adducted, and internally rotated. The remainder of the examination shows no abnormalities. Which of the following is the most likely diagnosis?","1. *Posterior hip dislocation* - The presentation of a shortened, flexed, adducted, and internally rotated right leg is highly suggestive of a posterior hip dislocation, which is a common injury in high-energy trauma such as motor vehicle accidents. The severe pain over the right groin and the mechanism of injury further support this diagnosis.

2. *Femoral neck fracture* - While less common than a posterior hip dislocation, a femoral neck fracture could present with a shortened and externally rotated leg. However, the specific description of internal rotation makes this less likely compared to a hip dislocation.

3. *Knee contusion* - The pain and tenderness over both knee caps could indicate contusions or soft tissue injury from the impact. This is a plausible diagnosis for the knee pain, though it does not account for the groin pain and leg positioning described in the scenario.",Posterior hip dislocation,accurate
18,"In a healthy individual with no renal abnormalities, several mechanisms are responsible for moving various filtered substances into and out of the tubules. Para-aminohippurate (PAH) is frequently used to estimate renal blood flow when maintained at low plasma concentrations. The following table illustrates the effect of changing plasma PAH concentrations on PAH excretion:

| Plasma PAH concentration (mg/dL) | Urinary PAH concentration (mg/dL) |
|-----------------------------------|-----------------------------------|
| 0                                 | 0                                 |
| 10                                | 60                                |
| 20                                | 120                               |
| 30                                | 150                               |
| 40                                | 180                               |

Which of the following mechanisms best explains the decrease in PAH excretion with the increase in plasma concentration greater than 20 mg/dL?","1. **Saturation of Tubular Secretion:**
   The decrease in PAH excretion with plasma concentrations above 20 mg/dL is best explained by the saturation of tubular secretion mechanisms. PAH is both filtered by the glomerulus and actively secreted by the renal tubules. However, the active secretion process has a maximum capacity (T_m, or transport maximum). Once plasma PAH concentrations exceed this capacity, additional PAH cannot be secreted efficiently, leading to a plateau in the increase of urinary PAH concentration relative to plasma PAH concentration.

2. **Competition for Transporters:**
   As plasma PAH concentration increases, the transporters responsible for secreting PAH into the renal tubules may become saturated or competed by other substances. This can cause a decrease in the efficiency of PAH secretion and excretion. However, this mechanism is secondary to the saturation of tubular secretion and is less specific unless there are competing substances present in significant concentrations.

3. **Back-diffusion:**
   Another plausible mechanism is back-diffusion, where at higher plasma concentrations, PAH can potentially diffuse back from the tubular lumen into the bloodstream due to a concentration gradient. This can contribute to a reduction in net PAH excretion. However, back-diffusion is generally a less significant factor compared to the primary mechanism of saturation of tubular secretion.",Saturation of PAH transport carriers,accurate
19,"A person is diagnosed with advanced metastatic prostate cancer. After further evaluation and staging, the patient is started on flutamide therapy. Addition of which of the following medications to this patient’s medication regimen would be of greatest benefit in the treatment of their condition?","1. **Leuprolide** - This is a gonadotropin-releasing hormone (GnRH) agonist, which reduces the production of testosterone, thereby depriving the prostate cancer cells of the androgen stimulation they need for growth. Combining leuprolide with flutamide, which blocks androgen receptors, can provide a more comprehensive androgen deprivation therapy (ADT).

2. **Goserelin** - Similar to leuprolide, goserelin is also a GnRH agonist. It effectively decreases the levels of testosterone through the suppression of gonadotropins, thus aiding in the treatment of prostate cancer when used in conjunction with flutamide.

3. **Degarelix** - This is a GnRH antagonist, which directly inhibits the GnRH receptors and leads to a rapid decrease in testosterone levels without the initial surge seen with GnRH agonists. Using degarelix with flutamide can also effectively reduce androgen levels and control prostate cancer progression.",Leuprolide,accurate
